{
  "schema_version": "1.0.0",
  "id": "EVD-WP-2026-0131-G07-documentation",
  "work_package_id": "WP-2026-0131",
  "gate": "G07",
  "claim": "the documentation this change carries",
  "evidence_type": "documentation",
  "producer": {
    "id": "badf-self-dossier",
    "type": "controller"
  },
  "source_revision": "HEAD",
  "target": "bstBizEra/badf:main",
  "toolchain": {
    "name": "git diff",
    "version": "1"
  },
  "operation": "git diff",
  "started_at": "2026-09-01T21:07:27Z",
  "completed_at": "2026-09-01T21:07:27Z",
  "outcome": "PASS",
  "artifact": "work/WP-2026-0131/evidence/G07/documentation.diff",
  "digest": "sha256:ec919d30b6b2f5308fe9d7960f221519daec935cdf20e48b80d4e9350ecb1fac",
  "binding": {
    "changed": [
      "docs/governance/GITHUB_CONTROL_PLANE.md"
    ],
    "contract_changed": true,
    "behavior_changed": false,
    "required_updates": [],
    "not_updated_with_reason": "documentation changed with the work package"
  }
}
