{
  "schema_version": "1.0.0",
  "id": "EVD-WP-2026-0117-G07-documentation",
  "work_package_id": "WP-2026-0117",
  "gate": "G07",
  "claim": "the documentation this change carries",
  "evidence_type": "documentation",
  "producer": {
    "id": "badf-self-dossier",
    "type": "controller"
  },
  "source_revision": "HEAD",
  "target": "bstBizEra/badf:main",
  "toolchain": {
    "name": "git diff",
    "version": "1"
  },
  "operation": "git diff",
  "started_at": "2026-08-31T15:21:08Z",
  "completed_at": "2026-08-31T15:21:08Z",
  "outcome": "NOT_APPLICABLE",
  "artifact": "work/WP-2026-0117/evidence/G07/documentation.diff",
  "digest": "sha256:e3b0c44298fc1c149afbf4c8996fb92427ae41e4649b934ca495991b7852b855",
  "binding": {
    "changed": [],
    "contract_changed": false,
    "behavior_changed": false,
    "required_updates": [],
    "not_updated_with_reason": "no documentation changed in this work package"
  }
}
